{"$id":"urn:lima:v4:lima.security-outcome","$schema":"https://json-schema.org/draft/2020-12/schema","additionalProperties":false,"properties":{"evidence":{"items":{"properties":{"artifact_id":{"pattern":"^[A-Za-z0-9][A-Za-z0-9._:-]{0,127}$","type":"string"},"content_digest":{"pattern":"^[0-9a-f]{64}$","type":"string"},"kind":{"enum":["lima.repository-profile","lima.audit-evidence-package","lima.vulnerability-evidence-package","lima.repair-verification-report","lima.workflow","lima.stage-attempt"],"type":"string"},"schema_version":{"pattern":"^4\\.[0-9]+$","type":"string"}},"required":["kind","artifact_id","content_digest","schema_version"],"type":"object"},"maxItems":64,"type":"array"},"kind":{"enum":["no_supported_attack_surface","no_actionable_hypothesis","mining_skipped_by_request","mining_skipped_by_policy","mining_blocked_environment","hypothesis_not_reproduced","vulnerability_verified","repair_unsupported","repair_blocked_environment","no_candidate_passed","verified_patch","full_chain_incomplete"],"type":"string"},"workflow":{"properties":{"artifact_id":{"pattern":"^[A-Za-z0-9][A-Za-z0-9._:-]{0,127}$","type":"string"},"content_digest":{"pattern":"^[0-9a-f]{64}$","type":"string"},"kind":{"enum":["lima.repository-profile","lima.audit-evidence-package","lima.vulnerability-evidence-package","lima.repair-verification-report","lima.workflow","lima.stage-attempt"],"type":"string"},"schema_version":{"pattern":"^4\\.[0-9]+$","type":"string"}},"required":["kind","artifact_id","content_digest","schema_version"],"type":"object"},"workflow_id":{"pattern":"^[A-Za-z0-9][A-Za-z0-9._:-]{0,127}$","type":"string"}},"required":["evidence","kind","workflow","workflow_id"],"title":"lima.security-outcome","type":"object"}