{"evidence":[{"artifact_id":"rvr-0001","content_digest":"a9a35d358308a2957b9182d2ca5e503903d8c7282c6c43bb09d1680313cb2cac","kind":"lima.repair-verification-report","schema_version":"4.0"},{"artifact_id":"vep-0001","content_digest":"cd76622b48d11c0300e63d7489701479c75dc2f4b06cc6c4e88af1f453061d01","kind":"lima.vulnerability-evidence-package","schema_version":"4.0"}],"kind":"verified_patch","workflow":{"artifact_id":"wf-0001","content_digest":"3be59c6c7f1736954fbce5f1e74b4c7789ab8a1e956f4229904ea30bbe756146","kind":"lima.workflow","schema_version":"4.0"},"workflow_id":"workflow-0001"}